{
  "overdueId": "OVD-500123",
  "policyId": "POL-500123",
  "overdueCategoryTypeCode": "OVD",
  "debtorName": "Acme Corp",
  "debtorId": "DEB-500456",
  "overdueAmount": 50000.0,
  "currency": "EUR",
  "dueDate": "2026-03-15",
  "invoiceReference": "INV-2026-001",
  "status": "reported",
  "reportedAt": "2026-04-01T09:00:00Z"
}